comment;score;en_com
"
เป็น รพ.รัฐบาลที่ให้บริการอย่างดีเยี่ยม พยาบาลยิ้มแย้มแจ่มใส อาจจะต้องไปเช้าเพื่อได้พบหมอ แต่การรอพบแพทย์ก็ไม่นานจนเกินไป
";5;Is a government hospital that provides excellent service Nurse smiling May have to go to the morning to see a doctor But waiting to see a doctor is not too long.
"
ชีวิตมีค่าในบางเวลาไม่อาจรอได้ เวลามารพ.มักจะต้องทำเองบ้างแต่ก็ดีกว่ารอคะ เพราะเวลาของหมอและพยาบาลมีความสำคัญยิ่งในรพ.ใหญ่แล้วถ้วนแต่แลดูวุ่นวายมาก เพราะฉะนั้นอะไรที่เราสามารถช่วยเหลือตัวเองได้ก็ทำได้ ไปจะได้ไม่เป็นภาระแก่บุคคลใครให้เป็นความล่าช้า
";5;"Life is precious, sometimes not able to wait. When coming to the hospital often have to do it myself, but it&#39;s better than waiting. Because the time of the doctor and nurse is of great importance in the hospital, but it looks very chaotic Therefore, anything we can help ourselves can do. Will not be a burden to anyone who is delayed"
"
หมอให้คำปรึกษากระจ่างดีค่ะ เข้าใจง่าย เจ้าหน้าที่ก็ต้อนรับดีค่ะ พูดจาดี
";4;The doctor gave clear advice. Easy to understand. The staff were very welcoming. Good speech.
"
พยาบาลดูแลหลังจากคลอดลูกดีมาก บอกและแนะนำดีมากโดยเฉพาะช่วยเหลือเรื่องการให้นมลูกได้ดีจริงๆ ถ้าไม่ได้พยาบาลคอยแนะนำ คอยสอนในทุกเรื่องที่ผู้เป็นแม่ควรทำ เราก็คงทำอะไรไม่เป็นเลย ต้องขอบคุณพยาบาลทุกท่านจริงๆที่ดูแลเราเป็นอย่างดี
";4;"Nursing care after childbirth is very good Tell and recommend very well, especially help with breastfeeding really well. If not, the nurse is advised. To teach in everything that the mother should do We can&#39;t do anything at all. Thanks to all the nurses who really care for us."
"
จริงๆก็ไม่ได้ไปรับการรักษานะคะ แต่บริจาคเลือดค่ะ พยาบาลและเจ้าหน้าที่น่ารักมากๆ... ตอนบริจาคเลือดเสร็จ แกล้งเป็นลม (ตอนนั้นไปกับเพื่อน จะแกล้งเพื่อนเล่นตรงหน้าลิฟ) เจ้าหน้าที่วิ่งมาจากในห้องบริจาคเลือด มาถามใหญ่เลยว่าเป็นอะไรมั้ย ประทับใจมากเลยค่า
";4;Really did not go to get treatment But donate blood Nurses and staff are very cute ... When donating blood finished, feigning fainting (at that time with friends Will pretend to play in front of Liv Come to ask big questions, what is it? Very impressive.
"
ให้บริการช้า รคิวนานใสก ไปอย่างต่ำเสับเวลาค่อนวัน แยากฝห้ปรับปรุงเรื่องกานบริการ
";2;Service is slow, long queue, clear, low time Pay attention to improve the service
"
หมอเข้าใจลักษณะโรคที่เป็น จ่ายยาตรงโรคกินยา2วันไม่มีอาการ
";4;The doctor understands the nature of the disease that is Direct medication, 2 days taking medication, no symptoms
"
แพทย์ พยาบาล บุคคลากรทุกส่วนงานเป็นมืออาชีพมากๆรู้วิธีรับมือกับภาวะวิกฤตต่างๆ รวมถึง ปัญหาส่วนตัวของคนไข้เอง และญาติของคนไข้
";5;Doctors, nurses, staff, all departments are very professional, know how to deal with various crises, including personal problems of patients themselves. And relatives of patients
"
ตัวเองได้คลอดก่อนกำหนดที่โรงพยาบาลศิริราชซึ่งไม่เคยคิดว่าโรงพยาบาลรัฐบาลจะบริการได้รวดเร็ว และดีอย่างนี้ เพราะเราเป็นเคทฉุกเฉิน อายุครรภ์25week+5 ตอนแรกจะเข้าไปตรวจเรื่องน้ำคล่ำกับตกขาวเยอะ แต่พอถึงโรงพยาบาลระหว่างจะไปยื่นบัตรน้ำคล่ำไหลออกมาเราก็ตกใจทำไรไม่ถูกเลยเดินไปห้องที่มีเจ้าหน้าที่ยืนอยู่และบอกเค้าว่าน้ำคล่ำไหล แค่นั้นเจ้าหน้าที่รีบหารถเข็นมาให้นั่ง แล้วก็มีเจ้าหน้าที่มาซักประวัติ สักพักก็พาขึ้นไปห้องรอคลอดเพื่อตรวจว่าใช่น้ำคล่ำจริงรึเปล่า คุณหมอทำการตรวจไปซักประวัติไปสรุปเป็นน้ำคล่ำจริงๆเลยต้องนอนรอคลอดเลย ระยะเวลาทั้งหมดรวดเร็วมาก ทุกคนเป็นมืออาชีพใส่ใจคนไข้ ยิ่งกว่าโรงพยาเอกชนซะอีก ทำให้รู้สึกประทับใจมากค่ะ
";5;He was born prematurely at Siriraj Hospital, which never thought that the government hospital would be able to service quickly. And good like this Because we are an emergency kate 25week + 5 gestational age At first, he will go to check the water, swell with a lot of vaginal discharge. But when he arrived at the hospital, when he was handed over the card, he was shocked. Just then, the staff rushed to find a wheelchair to sit. Then there are staff to wash history For a while, he took him up to the waiting room to check whether the water was real. The doctor examined the history and concluded that it was really watery. All times are very fast. Everyone is a professional, caring for patients. More than a private hospital Makes me feel very impressed
"
ครั้งนี้ไปพบแพทย์ด้วยอาการประจำเดือนมาไม่ปกติ ก่อนไปก็ปรึกษาคนใกล้ตัวว่าควรไปพบแพทย์ที่ไหนดี มีคนบอกว่าให้ไปศิริราช แว่บแรกคือไม่อยากไป รพ.รัฐรอนานเป็นวันๆแน่ ที่จอดรถก็ไม่สะดวก บัตรคนไข้ก็ยังไม่ได้ทำ แต่ปรากฏว่าไม่ใช่อย่างที่คิดไว้เลยค่ะ เราสามารถเข้าไปสมัครบัตรคนไข้ โดยการลงทะเบียนผ่านเว็บไซต์ของโรงพยาบาลได้ เมื่อได้หมายเลข HN มาแล้ว เราก็โทรไปขอนัดคิวเพื่อพบคุณหมอได้เลย เพื่อนแนะนำให้ไปคลินิกนอกเวลา เสียค่ารักษาแพงขึ้นอีกหน่อย แต่เร็ว ก็เลยโทรไปนัดคุณหมอ ที่นี่ระบบเค้าจะดีมากค่ะเมื่อโทรไปพยาบาลจะนัดเวลาและแจ้งคิวให้เราทราบพร้อมกับบอกให้เรามาก่อนเวลาครึ่งชม. พอถึงวันนัด ก็ไปพบพยาบาลที่หน่วยคัดกรอง ถึงจุดนี้จะต้องชั่งนน.และวัดความดัน ใช้เวลาไม่นานเลย หลังจากนี้ก็ไปนั่งรอตามคิว ซึ่งก็ได้พบแพทย์ตามเวลา(อาจจะก่อนด้วย) การรักษาก็ซักถามละเอียด มีการตรวจอย่างละเอียด ที่สำคัญคุณหมอได้อธิบายทุกอย่างที่คนไข้ถาม ไม่ได้รีบๆตรวจรีบๆทำให้เสร็จ คุณหมอให้อุลตร้าซาวด์ภายใน ให้ตรวจมะเร็งปากมดลูก ขณะที่อ่านผลอุลตร้าซาวด์คุณหมอก็ซักถามประวัติเราไปเรื่อยๆ ผลออกมาก็คือเจอเนื้องอกที่รังไข่ คุณหมอแนะนำให้ผ่า ขั้นตอนหลังจากนี้คือจะต้องส่งเรื่องไปยังคณะกรรมการเพื่อให้คุณหมอหลายๆท่านร่วมกันพิจารณา ว่าเคสของเราสมควรต้องผ่าตัดหรือไม่ ก็จะมีคุณหมอในคณะกรรมการเรียกให้ไปอุลตร้าซาวด์ซ้ำอีกรอบ เนื่องจากการผ่าเอารังไข่ออกจะทำให้ไม่มีฮอร์โมนเพศอีก คุณหมอเลยอยากจะแน่ใจว่าการตัดสินใจจะผ่าตัดเป็นวิธีที่ดีที่สุดสำหรับคนไข้ และพอทุกอย่างเรียบร้อย ก็จะต้องไปตรวจเลือดเช็คสภาพความพร้อมของร่างกายก่อนผ่าตัด ทั้งนี้เพื่อความปลอดภัยที่สุดของคนไข้ การจองห้องก็ไม่ยุ่งยาก พยาบาลจะนัดคิวที่คุณหมอว่างที่จะทำการผ่าตัด แล้วคนไข้ก็สามารถไปจองห้องพิเศษ ซึ่งระบุราคาห้อง ขนาด และแบบของห้องไว้ชัดเจน รวมถึงราคาอาหารด้วย แล้วพยาบาลก็จะแจ้งวิธีเตรัยมตัวก่อนวันมาผ่าตัด การรับประทานอาหารก่อนผ่าตัด โดยรวมๆแล้วการบริการที่ศิริราช ดีน่าประทับใจมากที่สุด พยาบาลก็พูดจาไพเราะ การคำนึงถึงความปลอดภัยก็ดีเยี่ยม ขั้นตอนการบริการก็รวดเร็ว ค่ารักษาก็ไม่แพงเลยเมื่อเทียบกับโรงพยาบาลเอกชน สรุปคือประทับใจที่ศิริราชที่สุดค่ะ
";5;"This time, went to see a doctor with irregular menstruation. Before going to consult the closest person to see a doctor. Someone said that he went to Siriraj. The first is not wanting to go. The state hospital waits for a long time. Parking is not convenient. The patient card has not been done yet. But it appears that it is not as expected We can go to apply for the patient card. By registering through the hospital website When I get the HN number, I call to request an appointment to see the doctor. Friends recommend going to a part-time clinic. The cost of treatment is a little more expensive, but soon I call to make a doctor appointment. Here, the system will be very good. When calling, the nurse will make an appointment and inform us of the queue while telling us before half an hour. At the day of the appointment, he went to see a nurse at the screening unit. At this point, it must be weighed and measured. It doesn&#39;t take long. After this, sit back and wait in the queue. Which was found by the doctor at the time (maybe before) Have a thorough examination Importantly, the doctor explained everything that the patient asked. Did not hurry to check, hurry to finish The doctor gave the ultrasound inside. To check cervical cancer While reading the ultrasound results, the doctor continued to ask our history. The result is a tumor found in the ovary. The doctor advised to dissect The next step is to send the matter to the board for many doctors to consider. Whether our case deserves surgery or not There will be a doctor in the board to call for ultrasound again. Due to the removal of the ovary, there is no sex hormone. The doctor wanted to make sure that the decision to surgery is the best way for patients. And everything is done Will have to go for a blood test, check the readiness of the body before surgery For the most safety of patients Booking is not complicated. The nurse will make an appointment at the doctor&#39;s office to perform the surgery. Then the patient can go to reserve a special room Which clearly specifies the room price, size and style of the room Including food prices Then the nurse will inform the patient before the surgery. Eating before surgery Overall, service at Siriraj Well, the most impressive The nurse talked beautifully. Safety considerations are excellent. The service process is fast. The treatment fee is not expensive compared to private hospitals. The conclusion is the most impressive at Siriraj."
"
ตอนปลายปี คุณแฟนไปคลอดลูกที่โรงพยาบาลศิริราช ซึ่งเด็กแรกเกิดจะค่อนข้างงอแงและตื่นบ่อย แต่ก็สามารถให้พยาบาลเอาไปอย่ในห้องเนอสเซอรี่ได้ตลอดเวลา ไม่มีอิดออด รวมถึงการดูแลต่างๆ ก็ดีทีเดียว
";5;At the end of the year, the girlfriend went to give birth at Siriraj Hospital. Which the newborn child is quite fussing and waking up frequently But able to allow the nurse to take in the nursery room at any time without being reluctant, as well as various care is good
"
คนเยอะ รอนาน ไม่มีที่จอดรถ พยาบาลไม่สนใจผู้ป่วย ส่วนใหญ่หมออายุยังน้อย ไม่มีประสบการณ์เพียงพอ ต้องมีอาจารย์แพทย์คอยแนะนำ
";4;A lot of people wait a long time without parking. Nurses are not interested in patients. Most of the doctors are young. Not enough experience Must have a medical instructor to advise
"
มารับการรักษาตรวจโรคข้ออักเสบรูมาตอยส์ เรียกเข้ามารอพบหน้าห้องแพทย์ให้รอเป็นชั่วโมง (จริงๆ ก็รอได้นะ) แต่ว่าน่าจะมีเก้าอี้ให้คนไข้นั่งรอ เพราะคนไข้ที่เป็นโรคนี้แต่ละคนจะมีอาการปวดข้อกันตลอด ให้มายืนรอนานๆ อย่างนี้ คนไข้กลับบ้านต้องมีอาการกำเริบกันอีกแน่ (เราเป็นต้น)
";3;"Come to receive rheumatoid arthritis treatment Called in and waited in front of the doctor&#39;s room to wait for hours (actually waiting for it), but there should be a chair for the patient to wait Because each patient with this disease will have joint pain throughout To stand and wait for a long time. In this way, the patient returned home to have a relapse again (we, for example)"
"
หมอและพยาบาลห้องคลอดดูแลเอาใจใส่ดีมากค่ะ
";5;Doctor and nurse, delivery room, take care very well
"
หาหมอคลีนิคนอกเวลา   ไปตามนัดหมาย วัดความดัน ได้บัตรคิว ไปนั่งรอหน้าห้องหมอ  แต่สิ่งที่บกพร่องคือ  ไม่รู้ว่าถึงคิวไหน  เรียกแต่ชื่อ ไม่เรียกเลขหมาย และแจ้งว่า ไม่ได้เรียงตามเลข แล้วจะให้บัตรคิวมาเพื่อ?!!
";4;"Find a doctor, clinic, part-time, follow appointments, measure pressure, get a queue card to sit and wait in front of the doctor&#39;s room. But what is defective is Don&#39;t know which queue to call but the name does not call the number and says that it is not sorted by number And will give the queue card for? !!"
"
คุณหมอและพยาบาลเก่งและมีประสบการณ์มากให้ความรู้ตอบคำถามได้ดี ใจเย็น พูดจาเพราะถึงจะมีคนไข้เยอะก็ตาม
";5;The doctor and the nurse are very good and experienced, providing good answers to the questions, calmly speaking, because there are many patients.
"
เราพาคุณป้าที่ป่วยด้วยโรคงูสวัดไปหาคุณหมอด้านภูมิแพ้ที่รักษากันอยู่แล้วแต่ด้วยคิววันนั้นเต็มเราก็ไปตามคำแนะนำของเจ้าหน้าที่เป็นคลีนิคนอกเวลาคิดว่าต้องรอจนคนไข้นัดตรวจเสร็จก่อนถึงจะได้ตรวจแต่กลับเป็นว่าเรายื่นบัตรแล้วบอกอาการนั่งร สัก20นาทีก็ได้ตรวจไม่เสียเวลารอคิวนานบางแผนกต้องรอจนคนไข้นัดตรวจเสร็จแต่เราก็เข้าใจ
";5;We took the shepherd aunt to find an allergy doctor who had already been treated with Q. That day was full, we followed the advice of the staff as a part-time clinic. Have checked, but it is back that we filed the card and told the sitting condition For 20 minutes, I did not have to wait for a long time. Some departments had to wait until the patients had completed the examination but we understood.
"
เป็นระเบียบและไม่ค่อยวุ่นวายเท่าไรถึงคนจะเยอะก็เป็นระเรียบและสะอาดค่ะ
";5;It is orderly and not too busy, so many people are smooth and clean.
"
มีการเปลี่ยนแปลงเรื่องบริการที่ดีขึ้นในบ้างส่วนทำให้ได้รับบริการที่เร็วขึ้นกว่าเดิมแต่ก็มีในส่วนจองการชำระเงินและการจ่ายยายังคงใช่เวลาในการรอนานเหมือนเดิม ส่วนแพทย์ที่รักษาประจำจะให้ข้อมูลและตอบข้อสงสัยที่ดีมาก
";4;There have been some changes in the service, in part, making the service faster than before, but also in the booking, payment and dispensing systems. The doctor who keeps the routine will provide information and answer very good questions.
"
คนมาใช้บริการ รพ.เยอะมาก การให้บริการยังดีเหมือนเดิม
";5;People come to use the hospital a lot. Service is still good as before.
"
ส่วนที่ไปทำการรักษาคือแผนกจิตเวช โดยรวมแล้วระบบของที่นี่ก่อนหน้านี้ค่อนข้างน่าสับสน แต่ระยะหลังศิริราชปรับให้เป็นระเบียบและเข้าใจง่ายขึ้นมาก การนำเทคโนโลยีเข้ามาปรับปรุงเพื่อแก้ไขปัญหาคนแน่นอย่างบันไดเลื่อนและแบ่งพาร์ตโรงพยาบาลให้มีส่วนที่ให้บริการคล้ายเอกชน ทำให้ประทับใจเรื่องของตัวเลือกในการเข้าถึง(ถึงแม้ส่วนนี้จะดูเป็นการให้บริการแบบต่างมาตรฐาน แต่พอทำความเข้าใจได้เมื่อพิจารณาค่าครองชีพและคุณภาพชีวิตอื่นๆของคนไทย)  หน่วยจิตเวชมีการให้บริการดีและเจ้าหน้าที่ทั้งแพทย์และพยาบาลเป็นมิตร การใช้ท่าทาง ภาษากาย และสีหน้าที่ไม่ทำให้ผู้รับบริการรู้สึกอึดอัด  ในส่วนของการรับยา เกิดปัญหาขึ้นค่อนข้างบ่อย การส่งใบยาไปไม่ถึง ลืมส่งใบยา การให้บริการของเจ้าหน้าที่ที่บางครั้งมีการเสียมารยาท  (โดยรวมไม่ต้องการให้คะแนนน้อย เมื่อปัญหาใหญ่คือทางเลือกด้านสาธารณสุขในประเทศไม่ได้มีมากพอ ฉันจึงมองว่า ปัญหาการจัดการของรัฐต่างหากที่ทำให้โรงพยาบาลรัฐที่มีคุณภาพอย่างศิริราชต้องมาแบกรับมากกว่าโรงพยาบาลอื่นๆ)
";4;"The treatment section is the psychiatric department. Overall, the system here before is quite confusing. But after Siriraj adjusted to be more organized and easier to understand Adopting technology to improve the problem of people like escalators and partitioning hospitals to have services that are similar to private ones. Impressed with the accessibility options (although this section looks like a standardized service But understandable when considering the cost of living and other quality of life of Thai people In the case of receiving drugs Problems occur quite often. The delivery of the drug is not to forget the delivery of the drug, the service of the staff, sometimes with bad manners. (Overall, not wanting to give a low rating When the big problem is that there are not enough public health options in the country, I think that the state&#39;s management problems that make quality public hospitals like Siriraj have to bear more than other hospitals)"
