comment;score;en_com
"
โรงพยาบาลมีคลินิคผู้ป่วยนอก มีคนมาใช้บริการเยอะมาก แต่ผู้ให้บริการ ผู้ช่วยเข็น พยาบาล ก็ปฏิบัติต่อทุกคนเท่าเทียมและเป็นมิตร มีรอยยิ้ม มีการบริการที่ดี ให้คำแนะนำที่ดี ให้คำอธิบายต่างๆด้วยความใส่ใจและช่วยเหลือดีมาก ความประทับใจนี้ทำให้ลืมเรื่องรถติดและคนมากมายไปเลย ที่ประทับใจคือคุณหมอให้เวลากับคนไข้ ให้ความรู้และอธิบายอาการของโรค สอบถามและใส่ใจในอาการของคนไข้ดีมากค่ะ ทำให้คนป่วยมีความรู้สึกสบายใจที่อยากจะมารักษาที่นี่
";3;"The hospital has an outpatient clinic. There are many people using the service. But the nurse assistant service provider treats everyone equally and friendly, with a smile, good service. Give good advice Giving various explanations with great care and help This impression made me forget about stuck cars and many people. The impression is that the doctor gives time to the patient. Provide knowledge and explain the symptoms of the disease Ask and pay attention to the patient&#39;s condition very well. Make people feel comfortable feeling that they want to be treated here"
"
เป็นโรงพยาบาลใหญ่ ที่อุปกรณ์ครบครัน เดินทางไปสะดวก คุณหมอและพยาบาลใส่ใจคนไข้ ดูแลดีมากๆ
";5;Is a big hospital Fully equipped Convenient to travel The doctor and nurse cares for the patient. The care is very good.
"
สอบถามค่ะ มีใครจองคิวกับเว็บนี้แล้วได้คิวจริงๆบ้างคะแบบไปแล้วรักาาได้เลย คือกลัวเสียเวลา
";5;Inquire. Has anyone booked a queue with this website and got a real queue? Is afraid of wasting time
"
โรงพยาบาลมีคลินิคผู้ป่วยนอก มีคนมาใช้บริการเยอะมาก แต่ผู้ให้บริการ ผู้ช่วยเข็น พยาบาล ก็ปฏิบัติต่อทุกคนเท่าเทียมและเป็นมิตร มีรอยยิ้ม มีการบริการที่ดี ให้คำแนะนำที่ดี ให้คำอธิบายต่างๆด้วยความใส่ใจและช่วยเหลือดีมาก ความประทับใจนี้ทำให้ลืมเรื่องรถติดและคนมากมายไปเลย ที่ประทับใจคือคุณหมอให้เวลากับคนไข้ ให้ความรู้และอธิบายอาการของโรค สอบถามและใส่ใจในอาการของคนไข้ดีมากค่ะ ทำให้คนป่วยมีความรู้สึกสบายใจที่อยากจะมารักษาที่นี่  
";5;"The hospital has an outpatient clinic. There are many people using the service. But the nurse assistant service provider treats everyone equally and friendly, with a smile, good service. Give good advice Giving various explanations with great care and help This impression made me forget about stuck cars and many people. The impression is that the doctor gives time to the patient. Provide knowledge and explain the symptoms of the disease Ask and pay attention to the patient&#39;s condition very well. Make people feel comfortable feeling that they want to be treated here"
"
ดิฉันมีอาการสะอึกไม่หยุดทุกๆครึ่งชม. ตอนกลางคืนแค่รู้สึกตัวตื่น พลิกตัว ก็เกิดอาการสะอึกขึ้นมา และมีอาการไอ ไอรุนแรง จนอ้วก เกิดอาการมา1เดือนแล้ว พอจะมีวิธีรักษามั้ยคะ 
";4;I have a hiccup, do not stop every half an hour. At night, just feeling awake, turning and hiccuping, and coughing, severe coughing and puke for 1 month Will there be a cure?
"
นั่งคุยปกติไม่มีอาการอะไรอยู่ๆก็ปวดท้องจื้ดขึ้นมาเลยแล้วท้องก็จะเริ่มแข็งขึ้นแล้วเมือนบวมขึ้นๆแล้วจะลุกขึ้นมานั่งไม่ได้พักนึงและเจ็บเป็นมารอบนี้รอบที่2แล้วอ่ะค่ะ
";5;Normal conversation, no symptoms, abdominal pain, chilling up, then the stomach will start to freeze up and then swell up and sit up to sit and not rest for a while Yes
"
หมอกระดูก ห่วยแตก วินิจฉัยโดยไม่ตรวจอาการคนไข้ 
";1;"The shoddy doctor diagnosed without examining the patient&#39;s condition."
"
คุณหมอมีความน่ารัก เป็นกันเอง พยาบาลใจดี แม้ว่าจะผิดนัด แล้วคิวคุณหมอยาวมาก ก็ยังสามารถให้วอร์คอินเข้าไปได้ ต้องขอบคุณจริงๆค่ะ
";5;The doctor is cute, friendly, kind-hearted nurses, even if defaulted. And the doctor is very long Can still allow the walk-in to enter Thank you really.
"
กาให้บริการและการตรวจรักษาดีมากๆพูดจากับคนไข้ก็ยิ้มแย้ม  ผิดกับโรงพยาบาลรัฐบางแห่ง ตวาดคนไข้ซะไม่อยากไปหาเลย อยู่แถวสามพรานแต่นั่งรถไปหาหมอที่ศิริราชเสียเงินก็ยอมเพราะที่ รพ.ศิริราชบริการคนไข้ดีมากๆ
";5;The service and treatment are very good. Talking to the patient is smiling. Wrong with some public hospitals The patient wished not to go. In the area of Sampran, but sitting in the car to see a doctor at Siriraj, wasting money Siriraj Hospital offers a very good patient service.
"
หนูไปพบหมอจิตแพทย์มาค่ะ หนูเป็นโรคทูเร็ตต์ชนิดรุนแรงต้องใช้ยาบำบัด หนูไปหาหมอที่โรงพยาบาลอื่นมาก่อนแต่ไม่ดีขึ้นทั้งที่ปรับยาไปเยอะมากค่ะ แต่พอมาเจอคุณหมอท่านนี้ หนูรู้สึกว่าหนูสามารถกลับเป็นปกติได้ คุณหมอสอบถามอาการที่เป็นและยาที่เคยใช้ค่ะ แล้วท่านก็วิเคราะห์จากอาการและยาที่เคยใช้ และปรับยาให้ใหม่ค่ะ ซึ่งการปรับยานั้นเป็นที่พอใจสำหรับหนูมากค่ะ ทำให้หนูคิดว่าทำไมไม่มาที่นี่แต่แรก คุณหมอให้ความหวังกับหนูและบอกว่าหนูจะหายเป็นปกติได้ หนูรู้สึกว่ามันต้องหายได้แน่นอน คุณหมอท่านนี้มีอารมณ์ขันมากและเข้าใจวัยรุ่นมากค่ะ หนูคิดว่าถ้าวัยรุ่นที่อยากจะหาหมอจิตแพทย์ก็ควรมาพบกับท่านนี้ดูนะคะ ถึงจะเป็นครั้งแรกที่หนูไปรักษากับท่าน แต่ท่านก็วิเคราะห์ปัญหาและอาการของหนูได้ดีและแม่นยำมากค่ะ
";5;"I went to see a psychiatrist. I am a severe type of Tourette syndrome. I went to the doctor at another hospital before, but it wasn&#39;t good either. But when he met this doctor I feel that I can return to normal. The doctor asked for the symptoms and the drugs that were used. And he analyzed the symptoms and drugs that were used And adjust the medicine again The adjustment of the medicine is very satisfactory for me. Makes me think why not come here first The doctor gave hope to me and said that I can recover. I definitely feel that it has to be healed. This doctor has a lot of humor and a lot of understanding of teenagers. I think that if a teenager who wants to find a doctor, a psychiatrist should come and see you. Even though it was the first time I went to treat you. But he analyzed the problems and symptoms of the mouse well and very accurately"
"
ประทับใจการรักษาและดูแลคนไข้ของศิริราชมาก ทีมแพทย์และพยาบาล มืออาชีพ ทุกคนน่ารัก เอ็นดูลูกสาวของดิฉัน ให้ความเอาใจใส่เป็นอย่างดี  ขอบคุณที่นี้จากใจจริงๆค่ะ เราจะไม่ลืมเลย
";5;"Impressed with the treatment and care of Siriraj&#39;s patients The team of doctors and professional nurses are all cute, loving my daughter. Give good attention Thank you here from my heart. We will never forget."
"
เนื่องจากไม่เคยไปรับการรักษา ไปครั้งแรก เพราะหมอที่ดูแลอยู่แนะนำไป ก็เลย แบบไม่รู้เรื่อง แต่เจ้าหน้าที่ที่ดูแล ให้การบริการดีมากๆๆๆค่ะ เข้า ชัดเจนทุกขั้นตอน ไม่หงุดหงิดใส่ ดูแลคนไข้ตามลำดับอาการป่วย ตอบข้อสักถามดีมาก ทั้ง ๆ ที่คนก็เยอะ คนไม่เข้าใจก็เยอะ ชอบค่ะ ดีกว่ารพ เอกชนอีก ที่ไม่ค่อยดูแลเราแบบนี้เลย เป็นกำลังใจให้เจ้าหน้าที่ทุกคนเลยนะค่ะ สู้ ๆ
";5;"Because he had never been treated for the first time because the doctor who had taken care of it was recommended. But the staff that oversees Very good service. Clear and clear every step. Don&#39;t fret Take care of patients in order of illness. Answer a lot of questions. Very good. Even though many people do not understand much, I like it better than private hospitals that do not care for us like this. It is an encouragement for all staff to fight."
"
ตั้งแต่เจ้าหน้าที่ รวมไปถึงพยาบาลและหมอ ให้บริการดีมากไม่มีอาการหงุดหงิดหรือแสดงสีหน้าไม่ดีกับคนไข้เลย รักษาดี ช่วยเหลือผู้ป่วยที่ยังช่วยเหลือตัวเองไม่ได้แบบว่าดีเยี่ยมมาก ถ้ามีลูกคนต่อไป จะคลอดที่โรงพยาบาลศิริราชเหมือนเดิม
";5;Since the officer Including nurses and doctors Very good service, no symptoms, irritability or poor facial expressions to patients, so good treatment, helping patients who are still helping themselves are not as good. If there is a child next Will be born at Siriraj Hospital
"
ได้ไปส่องก้ลองตรวจลำไส้ หมอให้ดูภาพภายในำไส้ แย้วทึ่งมาก ประทับใจ คุณหมอแจงรายละเอียดชัดเจน ภายในเป็นแผล หมอซ่อมแซมให้เรียบร้อย
";5;Went to see the gut The doctor gave me a picture of the inside of the filling. Very impressed. The doctor clarified the details clearly.
"
หมอเก่ง สามารถหาสาเหตุอาการป่วยของคุณพ่อ และชาวยรักษาได้ดีด้วย
";5;The doctor is able to find the cause of the illness of his father. And well treated
"
พยาบาลใจดี
";4;Generous nurse
"
เคยเป็นต่อมน้ำเหลืองอักเสบและภูมิแพ้ แล้วได้รักษาที่ศิริราชของคุณหมอดูแลคนไข้ดีมาก ตรวจหาสาเหตุอย่างละเอียด ตอนเจาะน้ำเหลืองที่คอมาตรวจ มือเบามาก แล้วก็นัดทุกสัปดาห์เพื่อติดตามอาการให้ยาติดต่อกันจนทำให้อาการดีขึ้นค่ะ
";5;Used to be inflamed lymph nodes and allergies And he was treated at Siriraj by the doctor who took good care of the patient Check the cause thoroughly When piercing the lymph on the neck, checking hands very lightly, then make an appointment every week to follow up with the medication until the symptoms improve.
"
เจ้าหน้าที่ตอบทุกคำถามแม้ผู้ป่วยจะเยอะแค่ใหน
";5;The staff answered all the questions, even if the patient is just a lot.
"
ต้องช่วยตัวเองทุกอย่าง ตั้งแต่เดินเอกสาร จนถึง จองห้องพักก็ต้องทำเอง เข้าใจว่าเป็น รพ รัฐ แต่ก็น่าจะมีการจัดการที่เป็นระบบมากกว่านี้
";3;Must help himself everything From the document until booking the room, it must be done manually. Understand that it is a state hospital, but there should be more systematic management.
"
พยาบาลดูแลดีมากทั้งการพูดการจาไม่แบ่งชนชั้น
";5;The nurses are very good in both speaking and not sharing classes.
"
ประสบการคือ วันนั้นเป็นวันที่23ตุลาคม ชึ่งวันนั้นเราปวดท้องคลอดลูกมาก ก้อเอาเราไปนอนรอที่เตียงเข้าน้ำเกลือ ฉีดยาเร็งคลอด ทิ้งเรานอนไว้ที่เตียง แล้วพยาบาลไปนั่งเล่นมือถือ พอได้1ชั่งโมงผ่านไปเราเลยเรียก พยาบาลคะหนูอยากเบ่งคลอดค่ะ ก็ไม่สนใจ เล่นมือถือต่อ พออีก5นาทีต่อมา เราเลยตะโตนบอกหมอว่า ไม่ไหวแล้วค่ะ จะคลอดแล้ว จนกระทั่งลูกหลุดออกมาทั้งตัว หมอพยาบาลค่อยวิ่งมา....รับลูกเราที่คลอด ...ไม่อยากให้เกิดขึ้นอีกนะคะ อยากให้สนใจคนไข้มากกว่านี้
";3;"Experience is that day is October 23 That day we had a lot of stomach pain. Let me go to bed and wait for the salt water. Injection of childbirth Left us lying in bed Then the nurse went to the mobile living When 1 hour passed, we called Nurse, I would like to give birth, not interested in playing mobile phones. 5 minutes later We, Tata, told the doctor that Can&#39;t get it, then will give birth until the baby comes out. The nurse is running ... Get the baby that is born. ... don&#39;t want to happen again Would like to pay more attention to patients"
"
จำนวนแพทย์ไม่เพียงพอ รอนานมาก พอได้พบแพทย์พูดจาฮ่วนๆ หน้าตาไร้อารมณ์ในการให้บริหาร คิดบวกคือแกคงเหนื่อย
";3;The number of doctors is not enough. Waiting for a long time. Face without emotion in the administration Positive thinking is that you are tired.
"
คุณหมอเก่งมาก ใส่ใจรายละเอียด แต่ที่เข้ารักษาเป็นคลีนิคพิเศษ ทำงานใกล้เคียงกับเอกชน
";5;The doctor is very good. Pay attention to details But that is treated as a special clinic Work close to private
